,content_id,content,subject,sentiment_value,sentiment_word
8243,uI7cE9vhsSUAWfRN,昨天下午特地跑一下高速和找了条少车的路跑了几个来回感觉好像是右前轮毂发出的翁翁声，随着提速声音越来越大。回个平时洗车的维修店，师傅还是这样跟我说：低速无声音不紧要，也不是轮胎有问题；就算是轮毂的轴承有问题离要换还早了点。若强烈要求拆卸下来查看轴承，轴承拆卸出来好坏都必须要换的。请问大家轴承是不能拆下来查看的吗？拆下来就坏了吗？必须要换新装上才可用吗？    ,配置,0,
8244,hpNV0YcjrX4n2uCy,我有个XV的朋友说，XV有个通病就是后轮毂轴承有异响，开不了多久就要换，他让我留意看森林人有没有这毛病,配置,0,
8245,ym7jCdqaPhnHJI8W,可能是后轮轴承的响声，应该更换了，自己检查的方法： 把车顶起来，转动后轮，用手摸减震弹簧感觉一下，如果有抖动，还有点呼噜噜的声音，就说明是轴承坏了，应该两个后轮一起换。 我的xv，9万多公里，两个后轮都换过了。如果要便宜就上万能的tb，我的xv后轮轴承220一个，找一个技术还可以的修理店都可以换，很好换。,配置,0,
8246,DfYGZnaIpi6WLo3P,后轴承4s店说13-16的车子都有问题 异响 4S店主动索赔的 摆臂也是主动索赔的 或许只有这俩涉及安全的才会主动吧,配置,0,
8247,Ow8bZyA9aEjCFqgh,下摆臂、后轴承在55000km都坏掉了！还好维修成本不高,配置,0,
8248,pfMBYHU1Vs5uXJoy,压缩机，据说是后来有召回的事情了。后轴承进水，5万公里遇到过。多媒体卡顿经常，已经习惯了，现在我车况6万，摆臂问题还没有出现，但估计也差不多了，15款车友路过。哥们儿，没烧机油的情况，就烧高香吧。现在的森林人是一茬儿不如一茬儿   ,配置,0,
8250,3kQGVoqp7uv0jaOF,按照B柱上的标识，多加0.1的胎压就好，4S的胎压打起来，用起来还好，就是长期使用，后轴轴承，轮胎磨损都比标准胎压要费，只不过短时间内体现不出来,配置,0,
8251,WSCVI34BfkxtsNmj,我想了一下，轮胎本来就是消耗品，而且歌安全有关，到了年份或者磨到寿命就得换，轴承只是响声大，但是换轴承花费也不小，牺牲一点点轮胎寿命换轴承的耐用性，应该还是划算的，关键是，胎噪小了就相当于花钱做了隔音～也算省钱的一种，   ,配置,0,
8252,KcDnv1r9tqZlPUeC,一直用手机连着蓝牙，这样可以实时刷新路况和电子眼，车机的导航信息更新慢没怎么用,配置,0,
8253,1H3iEKZTF6pfsCl5,既然要换导航，原车导航上的那些废文件留来做甚？（要留也可以拷到电脑里去的）原卡上只保留我说的那几个，再拷凯立德和你那个引导文件进去就OK了呀。   ,配置,0,
8254,rsxkB5X43L0fZ27b,山东济宁，16款2.5豪华导航，黑色    ,配置,0,
8255,EXh1jlZ0cvTm83De,在大广高速到过200，转速表现示比实际大概快10公里(GpS导航提示)。,配置,0,
8256,Pfmi30kKlENUv9Z4,很好，我也是这么改的，虽然一分二了，但是只能插一个用。 可能和导航机的U口支持有关。,配置,0,
8257,dmPWhJAl9iYto1NZ,导航主机要是音质好还用再折腾吗？又不想放弃大屏，所以才。。。。。。。。。。。   ,配置,0,
8258,asKjOhvG0ztYydi4,这个很可能是摄像头问题了。我换了导航机，安卓的，某宝上淘的杂牌货，一样倒车画面有延迟。   ,配置,0,
8259,TUicVP7KJBDjLx0o,我刚看了淘宝，还是用手机导航吧,配置,0,
8260,ykuMQ8bYIZLOXP40,1024x600 - 凯立德车载导航论坛-最新凯立德导航升级地图下载专区-GPS导航技术社区http://www.gpshk.cc/forum.php?mod=forumdisplay&fid=20&filter=author&orderby=dateline&typeid=264,配置,0,
8261,3k0QT2gIerYliPfo,报告，16款的导航机“好帮手”牌的，也没有AUX尾线。,配置,0,
8262,AWbc50Heo8YzEpPt,拍一张你导航机的照片来看看。   ,配置,0,
8263,jKvxGMcmq8ykbsAW,谢谢朋友的安装经验。我在考虑另一个问题，不知森林人有没有北斗 GPS双模的导航，现在中美开打贸易战，美国是否会对中国关闭GPS信号呢？如果是双模的导航就不担心这个问题了。纯属个人猜想，让朋友见笑。   ,配置,0,
8264,8OapXVWdYuLCU2Dl,蓝牙配对好了就不停点蓝牙音乐，就这样，10次不行重开手机蓝牙，重启导航，再点10次蓝牙音乐，还不行就抽它，这中控就是贱，欠揍!,配置,0,
8265,ZlqUKIOhXuvNiVze,换，没问题，现在的安卓导航机都带方控学习的。 都是原车束线插头对接，无损安装，简单方便。 不想要了拆掉还原也是简单方便。,配置,0,
8266,TcNFIguoHBvGP4Aq,只是为个导航没意义吧，手机导航更方便，这价格可以买个不错的手机了！,配置,0,
8267,KN6umWFGBsanTtPE,我前天试了一下，安卓的可以 用 亿联手机互联，成功把手机投屏到导航，但是导航操作比手机感觉差多了   ,配置,0,
8268,XN7U9wYHFJtCTpVS,没用过，觉得导航还是手机的好用。,配置,0,
8269,tbp3di0V7wvElG2h,从手套箱把数据线和手机相连，手机上安装亿连手机互联app。然后按导航提示操作连接,配置,0,
8270,qjuI5PbLSZdUihEc,机头我现在只听听歌，导航不用的，没办法喜欢森就接受森一部分缺点。    ,配置,0,
8271,bnAO0pGvNRV7koe9,我刚刚在论坛搜索导航的帖子，发现这个两个型号XAV-AX100索尼，先锋AVH-X8850BT。说是支持苹果Carplay，安卓Auto。但是我搜索了某宝，指向都是同一家钻石店铺，也有森林人买家安了的图片，但是有中控缝隙，看样子是个通用机头。,配置,0,
8272,i0T6OnExNsRaWXkm,我也从某宝买了一个14款的4G版导航，昨天刚安装好，从安装到使用都很顺利，音响效果比原来4S店加装的飞歌要好。,配置,0,
8273,BRxVJKkDzEGql4pA,rav4也不错的啦，不要迷信什么水平对置，四驱和前驱差异也不是大部分路况都有差异，如果你第一台车，rav4的配置比如导航啥的是你是最实用啦，森林人导航很山寨,配置,0,
8274,un8AZNHepwU0szdr,根本就是进口的时候不带导航，国内瞎装的   ,配置,0,
8275,Qq6K1W0fFiglaXGc,carplay适配器到货啦。300块实现carplay功能，不错。 楼主开苹果地图导航的时候有没有出现声音断续的情况。只听QQ音乐没有问题，只要一开地图各种声音就断续了。难道是我的iphoen6太慢了？,配置,0,
8339,yBvHNLIgFZ8p1oO4,我想知道有没有后排出风口,配置,0,
8340,BbwN5qdaKY3ijIxl,我原本放弃森林人是因为没有后排出风口，而现在新款森林人有后排出风口了，等新森了。,配置,0,
8341,NdBgpOl37hqETmcW,新款森林人已经有电子手刹和后排空调出风口的配置了,配置,0,
8342,NE8ZKaBCSUu7eT5o,出风模式开到吹脚的模式，座椅下面的出风口开始出风，其实，只要出风，后排温度比前排要低   ,配置,0,
8344,RhvbqdHkeL9JSDt7,出风口没风不得闷死，森林人默认是开外循环的，要按下切换开关才会变成内循环，无论内外循环出风口都是有风的，不想吹风你九把出风口关掉呗。    ,配置,0,
8345,8wzriyMcTxvDu62k,电子手刹，后排出风口都有了，这个AVH是不是类似于自动驻车？,配置,0,
8346,dy3HatKwmXREx8kq,北京车展只能看外形，看不到里面，实车外形没的说，杠杠滴；综合各方面的消息，内部应该是发动机换了，是新一代直喷自吸的，内饰好一些了，车身刚性提升了，科技感也提升了（比较上一代，如电子手刹，显示屏，后排出风口，后排USB），那个Eyesight好像也增加了一项什么功能（也许是更新版本吧），总之，如果十月发售，也倒是值得等一下的！,配置,0,
8347,BvDkpArgtK14nQxm,真佩服楼主的执着，楼主的结论对森友是莫大的帮助，我现在在改装后排空调出风口，失败了好几次了，也是被折磨的不行,配置,0,
8348,U2g4zMlf65kyrbGu,不是说今年的9、10月份么，4S 和 之家上都说了。运动版的看图片配置比较低哦，织布座椅无一键启动。   ,配置,-1,配置比较低
8361,HZauywfFn2xYGkNR,我到蛮期待 SGP 对新森的影响！,配置,1,蛮期待 SGP 对新森的影响
8362,uqfHWdw4FEcbxO7t,我也纠结这个，如果傲虎也出SGP那就不用考虑那么多了。,配置,0,
8363,vRbIlYgp1FMiqOnE,目前只出了2.5自吸，应该秋季上线。由于sgp这个平台可以搭载混动，因此混动可能也会出，不过至于什么时候上线就不知道了。,配置,1,
8365,Sx7KdRsFaCpU5m2Q,想多了，有机会去看看实车吧，比较现在的2018款来说，个人认为，仅说外观，整体性比现款好不少！新款厚重大气！再说一遍，不要只看照片！这次北京车展，现款和SGP款车都在一起，感觉很明显，这不是我一个人的感觉，几个对森感兴趣的人（都还没有买），也都是同样的感觉！如果不着急换车，我认为值得期待！,配置,1,新款厚重大气
8366,Y7L2Kgo5ukGHMFsm,我说的是新款sgp平台下的xv    ,配置,0,
8367,hxAWbq7usYgmkMFO,我看过实车，看过SGP款和2018款放在一起比对，个人觉得好的不是一点，照片和实车的确有差距   ,配置,1,好的不是一点
8392,LVMhnKWkJe6PI2p0,跟楼主一样，刚开始花了三千多块换了飞歌的DVD导航，后来觉得音质不行，还是换回原车CD了,配置,-1,音质不行
8395,bUdGhyZl7SpXMEBN,老马家啊 16款不知是否可以，你对照下中控看看,配置,0,是否可以
8401,eHLBWcd6Gn8pf2Ib,这个…要配置就没法比了。新CRV我一直在关注，看了车评就真心没有关注了，刹车！包括后来召回我都不知道，只是听说有那么回事……,配置,-1,
8421,ltIDeujWmHPz9G7w,16年11月入手10年2月2.5XT豪华导航版 价格14.5 车况完美 到手只做保养 公里数12 楼主参考,配置,1,
8426,Tu37Be9PGAD8Sbhm,我没说原车有导航，人家楼主的4s店给加装的是歌乐的导航，你查查价格和品质，已经是很良心了！你要是说歌乐不出导航，那就是你孤落寡闻了,配置,1,很良心
8447,9qkTeKwzf1IHuoRx,这个鱼和熊掌不可兼得，斯巴鲁把大量的精力都用在操控上了，配置稍微低一点也正常，但是绝对没有到寒酸的地步。如果真关心配置那么就不要选择森林人,配置,0,
8450,8hT2oGfOzC0KrH1m,8、9万的车配置都比森林人高，如果你是侧重配置的话建议选择其他品牌,配置,0,
8451,hF6qPoVJ7dWB2bpw,已经到的小改款，2.0的两个，配置都大幅提升了,配置,1,提升
8455,oY1M9k4wiRfXGpqv,不会，森的喇叭其实挺不错的～主要还是坏在中控上！,配置,0,
8472,ZJiHObzPjxFCSrec,你的哪个版本？就不知道这玩意多少钱，哪里买得到。如果方控和倒车影像都没问题简直完美啊。导航完全就没用,配置,0,
8478,CMdtbJnWVUqR4rIQ,2.5豪华导航的钥匙换成折叠了吗,配置,0,
8487,yP8eYrLHWK6NGXZt,哈，又是雪铁龙世嘉，我也被雪铁龙世嘉“亲”过屁股，损失后保险杠及雷达一个2000多元，雪铁龙世嘉头烂了7000多元。,配置,0,
8490,AVvjumrlaypdKOc3,手机要开启USB调试模式，我是垃圾三星3，可以链接，导航输出到屏幕，显示效果差，后来干脆用手机了，中控就一收音机！,配置,0,
8496,P7DLItCk3ueAvr6b,看到这个庞大强奸的山寨大屏幕（中控主机），心里凉凉的。建议大家暂时还是不要买,配置,-1,心里凉凉的
8497,Flt0aGbvsU2NudnC,9016自身无导航功能,配置,0,
8498,h2f1C5QGvydocuNe,哎 有渠道买到国外版本的中控主机就好啦祝庞大早日完蛋,配置,-1,早日完蛋
8507,SaZIVm4GOpftHBC2,是，之前看一日本提车贴就有这些功能，日本森es功能也配置了好一段时间了吧,配置,0,
8509,NxJblkXp27veKiEV,2018款森林人安全配置,配置,0,
8510,nbwCEuTWa5L2Qef3,但是看配置表，豪华和时尚的变速箱不一样，豪华是CVT，时尚模拟六档，到底什么区别啊？不懂,配置,0,
8523,BpZ3COESrMX1dGzV,18款上市了，配置确实提升了大灯也升级了，估计在为18款造势呢。,配置,1,
8535,v7CyTPiGa2lYF9J8,我的是原车CD，QJ导航不要,配置,0,
8536,AhFlRr1THe4xowcG,我15号到车，2018款2.5豪华导航优惠一万,配置,0,
8537,KOaHlNLX80YZfc4e,什么路况？你指的是导航软件?这是安卓系统，导航还不是随便装啊就算是WINCE系统装个导航软件也不是难事,配置,0,
8541,lQfFqjmwaAZepu6N,路况就是路况，不能联网的导航用处大打折扣,配置,-1,
8542,EPTKJQohzX7MRuv5,力狮有，信号取自倒车雷达。,配置,0,
8543,nVakwtjrdx4ylYT9,说的好。越多车有这些配置，上路越安全。,配置,1,
8547,qhpS4YNAxCRI89Gw,新款，我六月刚买的，尼玛现在全系升级配置,配置,0,
8550,kyP1aCB3VgueLjIF,中控导航哪儿换的？什么牌子？完美匹配吗？,配置,0,
8559,4v0HCYtjheBMQPDN,肯定要拆机咯，，看看是不是中控屏幕的背光挂了？所以屏幕其实开了，只不过你看不见（看不清）。,配置,0,
8567,1CuInXEpwZhxFYo5,那太多了，十多万的H5、BJ40、吉姆尼等，二十多万的奇骏、自由光等等，但这些我都不喜欢 选了个森林人，除了配置低点，别的不后悔,配置,1,不后悔
8568,NnAZa9XcxQfzBsvP,增加的配置多，不光是轮毂。,配置,1,
8570,4bFxaVoJsQK8Gpzq,美国是eyes 加导航 加价2000,配置,0,
8571,rCGm7i1lDfgEBbwh,2015年7月买的，2015特别版2.5，没怎么开，现在就担心车没电，放家里不到一周，电瓶没电两次。还换了一次电瓶，听说就是这个导航的原因。,配置,-1,
8582,1UgQulE7fLSke3a8,4月提车，07年01日出厂。送前雷达、LED近灯、电尾门、自动落锁及行车仪。,配置,0,
8587,DZeOKbimLB9QrRgH,一样的导航 可是我拆给了你 我就没得用了 哈哈哈,配置,0,
8596,yeaTR6Q1vWnIhMAg,咸鱼找下，一般改了导航的都会有,配置,0,
8598,0OkwKClGdsNXzx1u,原车CD用了4年多了，还是比较满意，不喜欢中控大屏幕，费电又刺眼,配置,-1,
8599,MOGRhuPtInklVdcx,我新车装完导航一星期果断拆了用原装cd.导航音质太差！,配置,-1,
8626,BIHLCwAOQSZyv1fx,说了这车子喇叭不差，中控差！,配置,-1,
8627,91optYOCs7lGKBWD,但是2.5烧机油真多，不差钱直接上2.0T，反正都是烧机油，配置还是最全的。,配置,1,
8674,6Q08Wi7mUDFEyVwo,和我一样，等等吧，说是下个月有车。小改款也就2.0豪华导航版最值，否则就买16款了。,配置,0,
8690,zfScEQAa6YBHJImT,不装导航的电瓶应该寿命长点吧,配置,0,
8696,JiQALdzkCtgH93we,请问你是哪年车型，2016的能装不，感觉导航没用。就想换个音质好点的，但有蓝牙，usb，倒车影像最好。,配置,-1,
8697,t2jWrEaKZoMpcb7S,你好，请问是有还是没有呢，配置表上显示是没有,配置,0,
8705,x7yYVTI0afvHgqLG,恭喜，森林人现在的配置应该说是小改款中配置最高的了，再往后就该大改款了吧。,配置,1,
8721,MteofNy429Lwsgxv,中控上面的小屏可以设置车内灯光延时,配置,1,
8729,aP6XxJckqZVHBeb7,看好了再买，纯进口，全时四驱，才高1.5万，你加个导航还多钱呢,配置,1,
8735,Sq4ElutWrdyswLHV,2016款，更换过导航机头，鲨鱼鳍，刹车开关了，这车真不让人省心,配置,-1,不让人省心
8741,fkDC2WhFc43Ko7lw,我从网上买的安卓导航，1500块，用的还可以，带行车记录仪和倒车影像，最主要是带高德导航，手机互联，实时路况。音质还凑合。我对音质要求不高。,配置,0,
8748,97mYGKqz1nsoFyRh,18款2.0配置增加不少，大灯，中控仪表盘，中间彩色小屏幕也换成老款高配车型，右侧反光镜下面多了个摄像头看死角，都挺实用的配置,配置,1,
8752,2QbFuE5fO139mVMR,2016款全系配置有ISOFIX接口，买儿童座椅要记住买这个ISOFIX接口就可以使用的，,配置,0,
8774,46lLJ2KZ3TDQypzA,你说的对。。我按楼主方法成功改了凯立德导航。然后到GPS论坛下载最新版凯立德地图覆盖，开机显示分辨率不正确。。。森林人的机头应该用什么分辨率地图？,配置,0,
8777,2zDhUHYAcl7o6LeX,中控台异响建议在和风挡玻璃接触处粘贴减震棉，可以去除异响，后背门异响为通病，可以调节一下锁块,配置,0,
8785,c8FZyXOP9zMIxGvl,高速驾驶傲虎比森林人要好那么一丢丢，但在城里开森林人要灵活些（车身短）。中控台傲虎要时尚些，坐后排傲虎要舒服些，其余森林人胜出。其实深林人制冷还是算快的。,配置,1,
8797,dWhsPvGxAYruk8ip,可能新xv出来，现在 庞大货的导航还没出来，就先装装原厂货，估计以后xv也换庞大货了,配置,0,
8799,FWNHrvjz0fMVYsId,18款2.0时尚和2.0豪华导航有啥区别，我咋没看出来了看配置,配置,-1,没区别
8805,9aFc7xBirJGUmeDf,恭喜恭喜  什么配置呢,配置,0,
8816,xWIMp5krnXVmJw4a,湖南18款2.0时尚导航 优惠8000 已入手,配置,1,
8839,tVRMS54HXksTqvQf,152.5特装版，准确的叫纪念版，拉力兰也就100辆，18寸树杈轮毂，屁股上带翼，其它配置与尊贵版相近，质量没的说，不烧机油，油门灵敏,配置,1,
8842,LYv73u4bnegjc0NR,看来配置对内对外还是有别啊！我就喜欢不带天窗的，平时开不了几次，保养和坏了的话更麻烦，国内的多给些实用的配置就好了！,配置,0,
8850,qYh28Am7cMzEKHXb,抱歉，是16款2.0时尚导航版的车。,配置,0,
8867,aEwhU1HmRkdbivq9,你所说的这些配置，16款2.5豪华（低配），除了日间行车灯，已经都有了。 其它还有方向盘、前后排加热，主驾驶2个座椅记忆，电动关闭后视镜。,配置,1,
8875,46qfXeG1twObrcHF,拿改装的钱，干嘛不直接上18款啊，18款比16款配置多了不是一点点,配置,1,
8889,I7HtuABa6olqRFYc,买机头的商家帮代购的。台湾产面板。也不是特别的完美，中控和机头中间的缝隙稍微大了一点，中控有点内嵌得太多了。,配置,-1,
8892,zsLF4xRSwrTKXZqu,这导航是国产oem的，要看你人品好不好了,配置,-1,
8893,sbhQL8dg2vR5oDnf,这垃圾山寨导航   早点换了吧,配置,-1,垃圾
8913,TnGNalDBtWiofxJE,我的换了导航也没有了，音质没有原厂的好了,配置,-1,
8920,v6npsSxoUra2l4g9,中控小屏可以调出来，脚踩油门踏板那个图标,配置,0,
8921,mW8QbOxIlVBukowg,早就甩了，现在用的卡仕达安卓机，阿尔派CD机倒模在导航下面,配置,-1,
8924,OqwnvdZUcE78iXQm,求兄台指点 买车前问过4S 能不能换15特装款的中控 因为我要CD 4S说不能装 尺寸不对。。。,配置,0,
8937,QH8NEJzTFSU52Mnh,车不热 发动机不能达到最佳状态 慢行驶至中控台水温灯（蓝色）灭了后 基本可以正常驾驶,配置,0,
8939,I3jhTfVRN6xtFPOy,方向盘按键只能接通或挂断，中控屏上可以拨打，不过查找联系人非常不方便。在联系人界面不能通过方向盘按键操作。,配置,-1,
8962,qt1gWIbrh9Nnlk4s,2016款时尚导航版森林人，跑210，还不是极限，因为油门没敢踩到底，车上4人，没感觉飘,配置,1,
8981,OlafcKBWRnJbYEiZ,你拿非官方的配置表去打官司。。。。。我挺佩服你,配置,-1,
8997,G4gl5LdAHq97RVrk,官方配置表没有CD……,配置,0,
8998,s5gFt1E9jM3i6RZ2,庞大的导航需要换吗 音质怎么样,配置,0,
9005,k3OQzYRIrBy4mA1X,闲鱼淘个二手的原装车导航，一定要原装的，不然后面的接线非常麻烦。,配置,0,
9026,9S1i2y5FqKNUfp6b,预算没问题就2.5顶配，配置和动力都要比2.0的高，好,配置,1,
9040,y9MvD0jEJLX4Fgew,GLC动力与配置并不差，相反在一线品牌里是数一数二的，x3Q5绝对相差很远。只是试了一下，前排感觉比486窄很多，后排也一样。,配置,1,
9071,bLpS4jh1sm6DguYc,谢谢！胎压监测配置里面有了。发动机护板、变速箱护板是不是更有用？,配置,1,
9079,R6TjAGP4iW0zmIr2,你的是导航鸡吗？如果是更换掉,配置,-1,
9086,CzsV0uIJU7W652l9,谢谢，请问原车导航能装凯立德吗？,配置,0,
9090,iXzog9dwu5f6G0qR,除了强奸的导航，其他都是小鬼子造的。发动机是日本零式战斗机的技术，如果有抵制日货的情愫，还是不买为好。,配置,-1,
9100,vJZrPFDLRxOpw1Tk,这二个配置在买车以后感觉到很无语,配置,-1,
9103,eZRATOtsiwkJmrKg,视频倒是不用，就是想把导航和电话分开，毕竟中途来电话太闹心了。但貌似支持高德和百度第三方导航，可选择以后就是无限的等待连接中。。。就它自己默认的导航一下就能用了,配置,-1,
9105,5glIOm4fAdGRujsv,这是15款2.0特装版的 或者是2.0T的车型 导航就是这样的,配置,0,
9129,DoOGkEcgXC0bVxI2,先锋8850，不过不带导航，但是有carplay，性价比高,配置,-1,
9130,LVAhRb9T3uy4DIXi,看看台湾的中控，哈曼的音响.tmd特色什么都跟别人不一样.,配置,-1,
9131,8A7qRGoVFzm91Spd,进口的时候中控是个黑洞，啥都没有。,配置,-1,
9136,Gt2vM0wTlKSD8Ozp,日本方向盘在右边。还有，你敢打开导航搜一下钓鱼岛么？,配置,0,
9153,kzWJGyP7ghTbqVIe,个人还是比较喜欢本田的车，选森林人其中一个原因还是因为同样配置，本田太贵。,配置,1,
9170,cor0gfpyvRBLQuYi,性能一样的 森林人车大空间大 VX高配比低配森林人配置高,配置,0,
9176,L9faodvGFHhV1UeO,广州优惠5k。送记录仪，发动机护板，安防包(自动落锁，前雷达等),配置,1,
9190,9eFKIWMY0GOfsaT8,大家都是用手机导航吗？开长途的时候一直用手机对电池的损耗很大呀,配置,0,
9226,vVLNHWqUyebMhYtB,外观那都不算啥，配置啊啊，16款哭,配置,-1,
9227,9UMNOQBlT0Rs7D5Z,16路过，这配置看了伤心,配置,-1,
9228,d5MRG2I1u3w6O0bH,买你能买的起的最高配置！,配置,0,
9230,ufh1dv6MO4rNXj78,看后想把仪表和中控屏幕换了。,配置,-1,
9231,P6Lo9Cm2xMyrI3Zk,2.0乞丐版就可以了，动力够用，性价比最高，安全配置一样不少，一键启动意义不大，没有远程启动。电动尾门极其垃圾，反应特别特别慢，没有高度调整,配置,0,
9233,1qZA7wOn4M3fNc0K,完全没必要，安全配置发动机变速箱都一样的，多出来的配置都不是必要配置，性价比不高,配置,0,
9238,9wUh3xWazZBJDHpu,仪表很不错的 只是中控辣鸡,配置,-1,
9241,yInaJTVBjF1WAdbQ,就冲新平台的车架钢性提高40%，其他看还能出个后排出风口么！,配置,0,
9248,rUaZq6SzE9H75Nnd,不为别的只为动力！2.5必须2.5！其他舒适配置都是浮云！,配置,0,
9250,pAwSvg1uKdNao4n9,那配置写的usb接口在哪。,配置,0,
9252,bM0lAWfsGScOjKYE,1.电瓶免维护，2.USB是否有的话全系都一样的（18款全系标配8寸屏幕导航的屏幕这类的配置都一样的），3.变速箱一样的，4.刹车片五六百左右，刹车片七百左右。,配置,0,
9282,KohOmCySUMjp3s8Y,看指标2018款2.0XT尊贵导航版动力好一些对吧,配置,0,
9289,3dPJcLRBiGDFNqsa,我索赔过中控，鲨鱼鳍，刹车开关，提车才几个月，前两晚故障灯又亮，估计又要索赔刹车开关了,配置,-1,
9293,NOrenAEasu8Tm2bW,车是好车，就是太贵了，而且外观配置这些明面上功夫完全撑不起这个售价，肯定关注度低。,配置,-1,
9308,GTnKEoj7JXaYqpLQ,建议还是买带eyesight功能的车型，也就贵四万，但配上其它一起增加的配置还是可以的。,配置,0,
9310,j6YuHS05iNDa7hs8,我有，刚买用了两个月，现在又回原来导航了，你搜一下网，带小屏倒车那款CD车机，功能一切正常，目前在仓库放着,配置,0,
9321,q8Do73Ate0hTg9ia,肯定比不了，那两个是在线的，很多实时信息比车载的强很多。但是百度的导航逻辑不行，还是高德、凯立德这种专业的强。,配置,1,
9327,yDMnb6ueKY3gvkZF,2.5低配—2.5豪华导航版或丰田RAV4、本田CRV、三菱欧蓝德、马自达CX—5都不错。森林人性价比不高，二手车保值率低。,配置,0,
9334,1bJ3q6IzRArVTFyG,又去看了看，居然说广汽三菱不厚道，日版厚道的帖子。在日本一个月都快卖出十位数的车，还提啥配置。  光指望海外市场呀？怪不得请了一个外国人当老大。,配置,-1,
9369,C9dU4DFvyNQuwOb7,我也是这个问题，新下的导航提示启动失败，请使用斯巴鲁专用导航。考进去原来的导航文件提示需要激活码。,配置,0,
9387,SBICdrczEx3gL7Jq,多了很多实用性配置，而且是全系标配,配置,1,
9388,WRXfHLzo9JlyBQm3,重启中控已经可以使用了，但是现在是搜到0个卫星，搜索任何地址都失败让扫码。,配置,-1,
9427,MsN2i76CPfItl4em,因为翼虎那个是雷达实现的ACC吧，比Eyesight还是差点意思。,配置,-1,
9432,hICuMvcYLqXeREfb,我是剪了一条吸音棉塞在中控台，异响再也没有了,配置,0,
9437,9Cep8H4XVxhuIYz6,我觉得还行，就是不能实时躲避拥堵。手机导航的时候突然来电话看不到地图的痛苦你不懂。,配置,0,
9450,mxL0ueMOYJInp5VE,可以考虑新途观l或者斯柯达那个换壳车 森林人的平台老了 配置还有动力都不好 对四驱要求不高的没必要买,配置,-1,
9452,Suq1Ot4KCMEAh0yJ,不接电话那段时间导航也会没有，容易慌张,配置,-1,
9457,X6k1bRE9JWjVMfaP,直接更新地图好了！感谢，这款凯立德导航好像导航文件夹里和老版不太一样，多了不少文件出来。,配置,1,
9458,PDhmFpwNXv4zA2x8,配置单上确实写的不一样,配置,-1,
