content_id,content,subject,sentiment_value,sentiment_word
AmVBbz2suMnJ1FGt,斯巴鲁产品的产品力在这个太差了，外观奇丑无比，尺寸也不行，内饰要吐，价格过高，配件又贵又不齐全，又要担心烧机油，到底是谁害了谁？    ,价格,-1,价格过高
2xl8X5o6quzH3ksW,我也很喜欢19款森林人，但是想想可能还是要放弃，1.小众 2.保养麻烦也贵 3.后续配件难找 4.外观太丑，尺寸小，特别是宽度不足 5.售价明显高于竞品 6.凤毛麟角的随时倒闭的4s店 7.有可能烧机油的发动机    ,价格,-1,售价明显高于竞品
AfO5cHxiqzuGksdK,我还想在磨一哈看看，应该还有下探滴空间    ,价格,0,
m1z4GB5IL2WfKyjM,也不是没有可能，因为这次经销商主要反的就是价格太高了，2.0应该是价格可以做得低些，再搞个混动价格估计和原来2.5也差不多吧，低配应该能便宜些，总得有点改变嘛！不过，日本为啥现在没2.0了呢，看来都动力升级了。   ,价格,0,
5mw0qZXPD41sLCxc,好没意思！你怎么不拿奇瑞QQ和X5比呢？价格一样吗？一看就知道是个没水平的人！,价格,0,
JUIm45wgLroQlnxN,这么贵 有被坑的感觉 保养手册有什么时间什么情况 换什么件儿 店里也应该有明码标价 一对价格就知道了,价格,0,
aqX2OYVIK5T7nixe,我也基本确定2.0时尚了，价格最低不知道多少能拿下。   ,价格,0,
4VUpPoZlBt6XSbaF,价格好低，我27号提的，253800,价格,0,
rZ5sWckd9GLXfb2Y,谁告诉你森林人性价比高了？森林人性能还行，价格比较贵优惠力度小，性价比很一般啊。森林人比RAV4、CRV、CX-5、奇骏、欧蓝德、指南者、自由光等等同排量、同配置的车型贵2至4万，其实驾驶感受与上述四驱车型差不多，故性价比不高是在价格上了……    ,价格,0,
pL0OXCob8ZqsSmdj,在车展挂个牌？还跟其它车型比较价格？你也想得出来……    ,价格,0,
yiAL6GScBVz35r7T,你说25万的1系2系，和25万的森林人包养价格差不多不是正常么？所以不要高估人群的能力。    ,价格,0,
r4FfLtARm2eDwVcl,优惠了多少。28.5万。还没有买保险。   ,价格,0,
0c9UfXLdquJ4Vwm7,扯淡的，羊毛出在羊身上。最直接能优惠多少，这个最合适最划算,价格,0,
SQRps1fH4FUwVdhB,同款同色，只是你的价格偏高了一点点,价格,0,
fQ6DaLBeryTmN82Y,这个价格不包括贴膜的吧？    ,价格,0,
aDYNVL0I5kn4j7Gt,看我认证，我6年买6个车，平心而论，斯巴鲁是我开过最好的车。很多人不买是因为不懂斯巴鲁，真正懂的人，你稍微贵点都可以入手的，你如果卖给车商肯定价格低的很。他们会说这车不行，保有量少，不好卖，这是车商的伎俩,价格,1,最好
qxGWd807ysEz3Ma5,优惠给的够，油水全部更换,价格,0,
cmxVaIDSHspLhzNA,什么时候到位？这不就是现款16，17款嘛。这款应该是2.5低配，价格自己查,价格,0,
jyXi3W5NK4nHfA1a,1.变速箱挂挡的时候，咔铛咔铛的金属撞击声； 2.跑了一点距离停车后，底盘有叮叮叮的声音，4S店人说是隔热板热胀冷缩的声音，但那么有节奏的声音，我很怀疑。 3.前轮刹车异响，那声音就跟指甲在黑板上摩擦的声音一样，4S店人说要磨刹车盘， 磨个刹车盘800，我换套打孔 划线的刹车盘都不要这么贵的。 4.内饰太挫、配置太低、价格相对较高。 其他的问题好像还没遇到过。,价格,0,
ARjd3nWIL2r7pg98,没感觉 20年出个特装 价格又没贵多少,价格,0,
yXCNRcgbYlx0trSj,4s1万一换 自己网上买了自己换 店里价格太高,价格,0,
j5dNSy2pQgFmExl4,这个看楼主的需求吧，如果是喜欢老款也是可以买的。而且现在的优惠相对大些。,价格,0,
f7oEmXTLRV0IudQe,车是13年7月买的2.5自豪，银色。现在9.5万公里，高速居多。没什么问题，车况很好。昨天去优信问了一下，给出价15万，想在论坛问一下大家，这价格给的怎么样，值得卖么？,价格,0,
oR7259KpyeJSlPg0,上网查了下，价格不贵，一个280，过一段换一套四个   ,价格,0,
pGKIHVOwzLeXATZv,我们这边还行，优惠力度还可以，现金能优惠2W   ,价格,0,
ts3d9lrqgaGifKjN,这个价格不贵呢。不错了。,价格,1,不贵
XVlmJPq5bzFK0wNS,浦东4s在夏天已经建议车主用5-30了，还是安索的，价格反正一样！对车主来说   ,价格,0,
gUpEc1rihdRHmvNb,带行里人看看还是。价格我觉得差不多。    ,价格,0,
t3MqlEJyInUxm7ga,楼主等新款到店再下单呗，钱在自己口袋又不咬人。老、旧款比较、衡量下增配和优惠，再下单。,价格,0,
Gifp0oNPk7EwV9Ax,老款和新款优惠力度会差很多，如果老款优惠2万，新款无优惠，给个LED和侧影就不划算了，要看你那儿4s店的实际情况而定。,价格,0,
r7lEWdODYyUN2zVc,我的价格高了，有点尴尬就不说了，买车就是投缘，车况好就果断拿下，这我的是11年的车，这种年岁的车，内饰干净，底盘机舱漏油的不多(有点自恋了哈哈)    ,价格,0,
celRfw2HmVohIXiy,上周六去丰台那个4s问 说最多优惠1万 如果5年在店里上保险 送20次保养,价格,0,
dFXeYqlRc6zn2Sg1,2016款最近买应该优惠很大吧，平均2.5万应该砍的下来，尊贵版裸车26.5都搞得定，办下来比沃尔沃老款xc60智进便宜最多3万，所以没有理由不优惠。,价格,0,
3OdnQ8RoFEtWkKZA,朋友，建议你去承德看看，7月看过一台，去年十月底生产的，11月底通的关，优惠两万二，今年四五月份产的估计可以谈到一万八。多杀杀价，无条件现金优惠,价格,0,
rZNRsJkfhpK064aX,这简直就是花钱毁车    这个价格不管哪里都能用最好的油   你却花了最高价用最垃圾油。。。。服,价格,0,
GnyNiLFA2QvPSEqx,机滤曼牌、马勒........大把选择；空气滤曼牌的尺寸稍小，可以选择博世、维克斯等大厂的，KN的很好，就是价格太贵；空调滤更是大把，钱多选择日本原装防雾霾的。各厂家都有标准了适用车型和型号，查查便知。   ,价格,0,
urVkP5QTMHG392IZ,看看价格，再跟老婆大人商量一下，合适就换了    ,价格,0,
WM6Is0Tw7DFoUZuc,这两货价格比原车的便宜多了，除非拆下的原车灯给你带走，不然还是别换了,价格,0,
1sRYEQpmXaedTo5n,店内的保险价格普遍比外面高很多，羊毛出在羊身上，多出来的钱也是当做你延保的费用，如果不是强制要求在店内保，建议在外面自己买。！~,价格,0,
0FbeNwniHo6RyD4c,淘宝上搜森林人胎压显示器，就两家有，东西价格都是一样的4百多，，我选的那个叫行车安全专家那家店的，看名字正规点。   ,价格,0,
rjiH9ZA85R4qlMUe,斯巴鲁最大的缺陷就是庞大一家代理，垄断了价格，造成凡是贴边斯巴鲁的什么都贵,价格,0,
XVSJ5lK3ZeQd7yD4,建议对比网络各个二手车平台价格在再做估算。个人估计和网友估计都带有很大主观因素，价格会相差很多。,价格,0,
Ceigf3YIQEWbumyR,就按2w优惠…敢问这27w上路那个城市？    ,价格,0,
tSTpLw3MBGfF7ONW,28.78优惠2W我说的是净车价！！！   ,价格,0,
6dy4Bx2fTM91WtF8,主要是价格上不去。。贵了没人要。添一点就可以上新车了   ,价格,0,
EyIuR5i4nTtg2l1Y,我在山西太原，多少钱，保险到啥时候？保养如何？价格多少？,价格,0,
8xk4EjyJIArHtBil,今天4s店碰到一个做保养6月份优惠2万 我往死里聊只给我优惠1.3万 在店内上五年保险 全车5年10万公里 送脚踏贴膜 装甲    ,价格,0,
jOnTNwxR0EGV8yo9,求保养和配件价格表，谢谢！308864024@qq.com    ,价格,0,
lcKe4QdbAJjL3PhY,优惠不大，送的东西没用，保险送保养千万别要，给你用石墨烯地沟油,价格,0,
fbg9olapsnUKy6ZM,不过一个时间一个价格，现在多少钱不一定了，我五月提的豪华特装，不同的车可能优惠也不同   ,价格,0,
SKnr7bNwQVE9ulX3,有点坑人啊，我上个月提的，17年5月的车，初始旅程9公里，提得裸车，什么都不要，全部算到现金优惠里，力度在2W左右   ,价格,0,
bquNhYramW5VfPld,喊贵的不知道是什么心态，斯巴鲁纯进口车，难道保养价格要跟国产价格一样？这不是扯dan吗？,价格,0,
EI6xoYtnXDCecLkM,没送保养，我想把价格跟他压到二十六万四不知道可不可以    ,价格,0,
NHmkcpCbVYuDRJ0v,落地26.6？这优惠非常厉害了啊！恭喜恭喜！   ,价格,0,
OUlNLSIwkBoWJiGQ,各地优惠不一，全国各地比没法比。你不如找本地的对比咯！,价格,0,
r1nzbqa7y6gkSYXT,现如今还是两万优惠吗？准备国庆去买，挂外地牌。全款和贷款有区别吗?,价格,0,
Dfw74rKjiHGmsQgS,这价格还有送这么多，车没什么问题就可以了,价格,0,
J20sOtScFerURA3j,楼主坐标哪 我周末也提车 2.5L 也一样的出产日期 但是只优惠了1W 您是因为库存的事再给他讲价了的吗？,价格,0,
T2p4bPAdNIJhXQKt,希望买二手车吗？二手车的水很深，价格可以便宜些。   ,价格,0,
idRWQyANCJnshIo5,到那时候老款肯定优惠更多，没多少日子了，等等看    ,价格,0,
DAJwesXHBETWLcfq,老款优惠1.5万，新款加价1.8万，差的就是ES钱，自己选择，其他的都一样,价格,0,
2VKFjGmlc5kuJ8Wh,新款下来应该没优惠，低配2.0估计都要30万,价格,0,
iQvjg6LOENKdsXkP,最多也就一万出头了，，光看优惠还得看加装买精品不 ，有些地方是要买精品才能享受那么大的优惠,价格,0,
KaA5JXj7ywxPQr3D,库存车看运气的 ·····一般是没什么事，再说价格在这里···性价比可以的,价格,0,
SJ1KTVIjbdzeN3fo,你这个很优惠了，差不多就行了。但是要大点的保险公司。   ,价格,0,
g1KhYjSJXGPwNFiC,家用安全经济，那不就2.0的了但是20的不比25的省多少油，也就价格不同吧,价格,0,
1aRIftpNeHCi7QzP,上海优惠1.8万万。今天看的,价格,0,
KpC75LEoASdq8uf4,国产了，价格应该会更优惠,价格,0,
5jmzu4U8lQqD3dkR,八月底提的车，优惠了2.2万，还可以还！坐标：江苏南通,价格,0,
5ruiZmXdgC7NaVwq,高了，至少优惠两万，望采纳……,价格,0,
oIQiHBdkE53947pc,PM下价格~~~~谢谢！   ,价格,0,
y5Drn6AXdzJZQYwo,怎么比？只有变速箱可以比。其它就算了吧！哦，还要价格。,价格,0,
qwacjzmAD1WYn3M8,徐记的，双十一看有没有优惠，我问准备买一个,价格,0,
gbLlivH6sSVCAFUP,有这个问题的，主要还是考虑预算吧 如果要比较的两个商品、其参数太多，那么就看你相中哪一点。如果你要综合看，ok，价格是最好的分数，一分钱一分货，,价格,0,
ZFgl9TvkQ3bcqLIt,2.5尊贵，裸车价优惠1.5万    ,价格,0,
06Fk9KfIJB1reoSz,价格便宜，检查好车况再出手。,价格,0,
ldaVNUDFvG3qIjHQ,5月底提的，优惠1.5万。,价格,0,
KfGAL4JdojFXbMug,各种配齐的尊贵版捆绑ES后价格又高了。。。,价格,0,
p4y5PUlBLomiE2dq,前2个星期去修理厂检查车况时遇到森林人1几款的车主记不住了，他是2.0t的森林人他订购了摆臂装不了，还问我要不要优惠处理给我，聊天时没有聊到摆臂问题，下次保养时好好检查摆臂和了解车况   ,价格,0,
ve25NtlIuFcgCzmZ,看优惠程度吧，3月份算不上库存，只不过小改款要上市。,价格,0,
IidLAb2BCRGlzKZy,这价格尊贵都嫌贵。。。   ,价格,0,
rl5sMTE9VYeJDwm3,你就不能等等？新款以上看看还有没有优惠了，买新款也成啊,价格,0,
tbD15G872JirCcSp,老款优惠少就买新款ES版，老款优惠给力这俩就看你自己的喜好了。,价格,0,
052CQXiOdaV3zve9,有点纠结了，是要现款2.5低配还是等新的这个eye版本？新款没优惠……多啦配置,价格,0,
AE87bLU4HSzsuFTC,那就买现款呗，优惠还大，当然如果等的及就等新平台，虽然新平台不见得能像宣传的好多少多少，但新平台肯定比旧平台要好，不过感觉至少还要等一年    ,价格,0,
bqd2wzUJemXPnW7Y,等几个月优惠起码1万加   ,价格,0,
HXj87v0idzqQYfIg,我车就是10款十万同辉，你这价格真是便宜。最好查查车。如果有问题就不是一万的修理费了。,价格,0,
S8Xc6sIOx4KCkZQR,新款没优惠，配置上变化不大，性价比不高。,价格,0,
ONRjKPyIgZEWne7X,以斯巴鲁代理的尿性一般新款出来后优惠肯定会缩小，不过换代在即，过个半年大半年应该还是会有比较合适的优惠的    ,价格,0,
iVq16CtK0vOpAjJT,我在哪里买都行。就是不知道你们说的自己买的优惠在哪    ,价格,0,
ZPsoz8aA9x1RlhqN,3月份的车目前已经属于库存车啦！建议你还是选择最新月份生产的车吧！除非这车优惠力度比较大！,价格,0,
U9sXrpibCzY7uVFZ,现在要么买16款赚优惠，要么等明年换代吧，17款很尴尬，就多个鹰眼，没优惠还多一万多,价格,0,
QJLHD6d8ufx2EWy1,顺便了解下4S店刹车盘什么价格，有知道的兄弟吗？我在上海。,价格,0,
P9aQ2jzmnWEuUblf,周日看了2.0时尚导航版落地说是28.7。指导价算的,价格,0,
EtwWgKTBs8x1chbF,你去看过了吗？我暑假的时候去西乡那边看过一次，好像最多就优惠5、6千，不会超过1万。重点是，他们的销售全是汉子，是汉子啊    ,价格,0,
6DByqFsdgXUaMu50,看中就买了，新款又不知等多久，优惠可能很少。     ,价格,0,
VNygKiodQTsw0C6j,没问题，优惠1.5也可以，快上新了，老款估计还能再砍一砍，送了什么？,价格,0,
R4djqwJnzTcaY5Ef,三月份应该是的，但是也还好吧，毕竟拉过来都要三个月。如果你要买价格可以在要第低一点，因为小改款森林人快要上市了肯定清仓促销的，要么等改款上市，同样的价格还有很多配置，还有eyesigt,价格,0,
QxVw7tslmU0uPie4,价格还是相差好几万吧！,价格,0,
NIGhaTbLBmnJ031c,我打算星期一去提车，问了销售，也是今年3月份的车，进口车6个月，差不多吧，当然能以此多争取点优惠也不过份吧。,价格,0,
XKMqbDO2fRNAzG18,不知道等新款还是买老款，马上国庆了，估计老款优惠大，新款配置高。    ,价格,0,
8DpOvI4oL2kxuQwc,价格可以再谈，就是不知道这车稳定性怎么样，进口车后期换件尴尬啊    ,价格,0,
kpjVGL1qHn4cbPdB,要给合理价格也要先说几年几公里吧    ,价格,0,
ktyYJoA854MgSQ9l,保险改革后，划痕险不划算，小的划痕没必要处理，严重的自己处理也几百块而已，出险一次太影响续保价格了,价格,0,
FyKboO0NmVuHahqG,个人认为性价比最高的莫过于2.5豪华导航版，个人浅见，不喜勿喷！,价格,0,
afDkMwH6I4m7N1eu,以前有这个说法，但现在真的还好，配件价格是原来的三分之一了，但他是整车进口，配件贵一点也正常，森林人吧，而且森林人要小改款了，同样的价格有多了许多配置，你可以在等一段时间在决定,价格,0,
AgWvMrRZce3aByTJ,你可以问一下4s，应该不会太久，不过看你啦，老款价格肯定会便宜不少，但是新款加了很多配置，你可以看一下论坛里关于新改款的帖子    ,价格,0,
HsvT1Q9fwgDyxpP5,最近，16款森林人清库优惠大，买现款还是es款好，另外2.0还是2.5啊   ,价格,0,
lGyRhOEn4U7bPd3g,经济适用。价格保值CX一5。喜欢差路旅行走小路。森林人。,价格,0,
jDdKcnX1RawyubEf,预算足的前提下当然是越高配越好了。我认为es2.5首选。因为森林人优惠本来就小，去库存也就优惠小两万。你差两万不买个新款？啥像有的车一改款优惠十万八万的你买老款还行。等新款吧马上来了    ,价格,0,
leLrS3kCE6ofR8h5,价格差太大，没有对比意义,价格,0,
8RYse9xdVQKrBGiH,16款2.5尊贵 目前什么优惠幅度呢   ,价格,0,
5sEPrbLAjU4VvwDY,对对，哈哈，现在价格优惠了，划算呀。    ,价格,0,
VwJmKRHIukc74C0x,其实我要是想改早就提了，就是不想新车买回来拆的乱七八糟的(拆完怕有异响)，现在出厂都给配置齐了省去自己改装的麻烦和风险，我们这里现在就清库存了，2.5特装已经没有了，想定只能去别的地方调配，而且优惠不大。    ,价格,0,
haxkQRPL2lc7qyW4,你现在有优惠，新款上了估计没优惠，而且你早买早享受了这样有没有舒服点,价格,0,
R85yQIlEVGUrCkL6,什么颜色车？我想买一台。价格合适车况好就出手    ,价格,0,
yzKZHu7rQekY9sR0,是啊 钱包太憋 只能买个低配啦 不过看中森林人也因为确实配置挺厚道，被动安全和大多基础配置都是全系标配的。现在又有优惠就出手啦    ,价格,0,
E9jyk1fHhFpxsv6z,那些纯粹问问价格，要图片的真心别打扰了，,价格,0,
HUlXD4KE5wrnZdPm,我刚定同款！能说下你的价格吗哈哈,价格,0,
Pt48yOu1xQNUJcH9,反正先打脸打一波不知道今后会不会有政府干预，或者导致合资车进一步降价   ,价格,0,
QECihAFcPuxNGqdO,买16款的吧，十一之后南方优惠大。因为17款eyesight要上市。性价比高。    ,价格,0,
KNbHyl4QLpCXvTWP,我入xt前对比过，nx 一定要入混动，混动才是雷家的经典！新300价钱也降了不少 隔音nx好些 但也不是好太多，开起来森爽！nx优惠基本3.5w 论底子nx还不如mkc 建议你看看mkc 底子虽然是翼虎 操控也好与rav4,价格,0,
v12iHQwRA4h9Vzgl,城市要四驱有卵用 还有现在长安装配提升不少 顶配2.5价格森林人只能买2.0乞丐版 国产有国产的好处 配件周期短 切便宜    ,价格,1,便宜
a764vp3Dh1FnjiJr,3M、龙膜假货太多，我贴的是国产康德新KDX，国内大品牌，质量不错，价格一千多。,价格,0,
4ZVoDLIOWJqQrvmN,不带随动功能，4S店说原价不到7000，因为我在哪里买的车，可以优惠到5000. 不可能是一个   ,价格,0,
i0wblLoJg4BPIkUn,操控非常满意，维修配件看不同地方可能不一样，像上广等地4S店多、靠近港口，常用配件等待时间较短，偏远地区可能等待时间稍长；保养满意问题，常规保养费用在700元左右。因是小中产品，配件都为原厂，价格偏高，除非拆车件。根据熟人介绍，基本没有毛病，不担心修理问题。本人用车不多，上一辆车12年还没有过十万公里，因此衡多问题根本不用考虑。   ,价格,1,操控满意
ElzVhO2G0fBSdtCx,这些配置有几项是后期加不了的。所以利益自己衡量吧。个人觉得绝对比优惠1-2万来得值（这些配置简直是2017款2.0低配和2016款2.5顶配pk了）。                        ,价格,0,
59ySQAZYcC4LnHKx,团购结束了，如果你要我先把我的给你。你可以去网上对比一下价格    ,价格,0,
EfIwAzpNtG7vYZnl,一万左右的优惠，是基于指导价23.98万？我四月份买的都杀了一万五了     ,价格,0,
miDxoBateHW2SdON,，，，地区不一样，说优惠程度不一样。    ,价格,0,
vcRDXztC2VO5BWHd,越快越稳不存在，方向盘沉主要是看配置。约家用化的车，约是会有这样的配置。当然，价格得到位~,价格,0,
txrRmYnE0fSboh6e,做正常保养价格真的不高，比神车便宜很多。,价格,1,便宜
4UoLAQgDhnYtrxbv,我的同事8年的卡罗拉5万公里，4s店收8万元。如果这车没有改里程价格还是很不错的。,价格,1,很不错
PoF2qw04dnXUi5e8,1213的森呗。12的卖的可能少些。13的价格可能楼主又不合适。慢慢碰吧。推荐12的森。硬件配置一点都没降。13后的内饰是好了很多。但是车的配置低了很多。,价格,-1,不合适
0emxdcilMVbY6CA5,在吗这位车友，想问下se和s3配件哪个贵一些，两车的维修和保养价格能说下嘛,价格,0,哪个贵
zB7S0rimdoHgeO8L,这是美孚经销商大会价格还是就是代理商处价格,价格,0,
YMp5FUOPTy2v4fX6,四儿子600吗？还是京东淘宝之类的网店自己买机油机滤的价格哦？？？,价格,0,
DX5t0QbzqEi8YVrg,无框的森，2006、2007年的，现在确实是5万、6万的价格。,价格,0,
ypARCr2nHMvYWBGt,就马马虎虎的擦一下，不是很细致的。如果机舱很脏还是外面去洗，每个地区价格不一样的,价格,0,
dW1QYBzHPNZm9K78,价格咋样，恭喜楼主，打算入手2.0盖中盖,价格,0,
5OqVzA83NW72GKt6,买s3主要是因为价格相对便宜，加速和内饰好点，我留着se的话s3可能会让给家人开了,价格,1,便宜
X6HyNkcLxU31Wjfa,有一定的可能，本来凡是发动机都会磨损，机油用好一点的全合成，而且既使磨损，EJ的维俢换活塞环这些是非常成熟的，而且价格不贵，换个修理包又可以用20万公里,价格,1,不贵
q1cFyBimNP257bpn,森林人和GLC相比较除了车价格，保养，维护便宜点，其他没比性，不信你问问那些换GLC的人就知道了，GLC当年出来我想换车，比较过，森林人根本不能跟他比！,价格,1,便宜
IKV5CFXZ2fx6AP37,是转运的，我同事弄的，他说是个技术活，不过，到手后价格没有优势，纯粹是图个放心,价格,-1,没有优势
aKPQgXwJdzL07t8H,途虎出光0 20，298元，价格不贵量又足,价格,1,不贵
0q73cz4ZQlWdGRjC,价格决定一切，推荐奇骏。,价格,0,
7OjHFi4Q6Yzbd3Th,这是给你价格一般行货都很贵……,价格,0,一般
to4E2k7WOhQBcpZR,离得太远，其实这个价格可以的~ 我秋季换胎打算就换G012,价格,1,可以的
Y0Aq8w7dGMCBmH9N,这就是传说中的三灯齐亮，基本上是三元催化和前后氧传感器故障，传感器比较好处理，三元催化就看你所在地区的修理水平了，换的话价格不菲。,价格,-1,不菲
QDhX4GUItdVbB7Ns,我去上海去改的，价格也贵。改了，实用性是好点，那个门没关也知道了，还有油温。,价格,-1,也贵
9ibmTtDvpBA1Lx6j,这价格低的有点离谱，所以就觉得有点奇怪。二手车调表问题是常态，如果发动机出问题再便宜都没意思了,价格,1,低
eY3jptkSZoGKNxmd,奇骏才出道几年？谈不上什么经验！森林人久经考验，以操控、4驱闻名天下。修理费的事少去4s店，费用不高。,价格,1,费用不高
i5nE9pcfHRxylhr4,你难道不觉得森林人国内价格有点虚高，美国才买3万美金出头。推荐CRV或RAV4，国内价格和美国差不多。奇骏我个人不喜欢。,价格,-1,虚高
XfvNzbOeSEoGYAQt,我刚装上使用时间也不长才开了3000多公里，感觉目前可以的，价格比进口的便宜多了后面两个总价475元，某宝上买的,价格,1,便宜
AVHtan6QSCM7z8vr,13-14，他就算0公里市场也不会给他超过14的价格,价格,0,
gv3GSnVjtkobpBiI,森林人的机械性能比crv强，crv在配置和性价比上比森林人好，就看买车人的需要了。不过crv是新车，估计加价提车是免不了的，所以前期上市的新crv性价比不高,价格,-1,不高
48FZAHRdNsmhgleq,想必价格大多数人还是可以接受的，必竟性价比很高,价格,1,高
o1eB2Vvs7SYmaRrz,价格高了，另外原价不是27，还有就公里有点多。,价格,-1,高了
bnv7aWFw3zlqBI9D,想想当年驰鵬的价格吧，肯定不会便宜了。,价格,-1,不会便宜
TOgqw3xWZQlJkNXv,机油5L 425 机滤51 加工时费600.5 这是我35000公里最后一次去4S保养的价格,价格,0,
mJRYwUWICP8fkLj5,正宗原厂的、和这个一样的大概2600左右吧，这是4s店的价格。,价格,0,
Xx0Z4b3DksPFpnzy,5分钟开什么车，自行车锻炼又环保！森不适合你，推荐捷安特山地车！坏了扔掉重买也就小森一次保养价格,价格,0,
GsHwbY3mO1SLA7gd,呵呵，要是车况没问题你这个价格论坛里不知道多少人跟你定车。。。,价格,0,
Ua9sycxKOdqN5Hbi,抛开终端价格来比较，CRV的人性化设计更好，森林人在机械上成本更高。CRV主要是那个大驼背难看。,价格,0,
q67Y3TwVERJkiFn2,在外面找家技术好信誉高的店，比4S店搞得还好，而且价格便宜不少呐。我的上一辆车都是在外面弄得，很便宜无色差。我准备现在的这辆百森继续找这家店弄。,价格,1,便宜
qeKM6XjZLo0JpHID,我看来宝宝上也差不多要这个价格，其他品牌五升还要贵了。只要是真机油就好了，出光机油也好似日系的常用油,价格,0,
IUj7aVLvpdZWiR2x,前提：发动机正常，车架完好。然后检查四条腿是否完好，脚丫是否需要更换，正时皮带哪年换的。前档玻璃是否完好。一切正常的话，不超过发票价格的25%,价格,0,
wroLVhRIJZc26fbj,谢你了。在本地看到一个车商的2010款，09年11月的2.5T开价13.5万，说9万公里。你觉得价格多少合适？,价格,0,
0nLyfVobSN4QPJ8O,不到七年的车，车保养的好，没事故，没水泡，没大修，不烧机油，这价格还是可以的，看是几手车了，看多少公里了,价格,1,
53gGEhxNI4bfju9q,深圳价格2.5的裸车优惠应该在16000左右，再往上的话余地不大,价格,0,
gDmQz3kZFRYVjrsE,还没，持币观望，价格合适立马下单,价格,1,
woh6C1HeVGBvquTr,保养价格一般，配件比同级别车贵。,价格,-1,
ZXtj7gkzL3vDOnqf,正好在6个月的临界线上。价格实惠的话不用太纠结，让4S店检查下电瓶并且更换下机油。,价格,0,
vm3FiE5dbO2cKtaI,车行也是说保养可以去4s保养的车，就是纠结11月的车要不要，不知道尊贵版的有没有车友提到今年的车，价格怎样,价格,0,
BsFIdzLVbPMTxwcG,我看了你的帖子 你是不是换了ap5200四活塞 ？ 森林人xt240匹 换4活塞完全够了 你在哪买得 价格 私信我 谢谢,价格,0,
